站號,廠牌,站名,行政區,郵遞區號,地址,電話,負責人
AV2,光陽,孟軒機車行,文山區,116005,臺北市文山區木柵路一段180號1樓,(02)29392858,鄭如傑
AV3,三陽,動力羊機車部品開發有限公司,內湖區,114031,臺北市內湖區新明路339號1樓,(02)27946855,陳宋誠
AV4,山葉,鑫勝車業行,內湖區,114053,臺北市內湖區文德路90巷28號1樓,(02)87510921,郭忠勝
AV5,三陽,德興鑫車業行,大安區,106068,臺北市大安區延吉街270號,(02)27086699,陳冠豪
AV6,光陽,辰昶機車行,信義區,110006,臺北市信義區信安街80號,(02)27328138,何榮峰
AV7,三陽,原馳機車行,北投區,112063,臺北市北投區東華街2段14號1樓,(02)28223776,宋柏緯
AV8,三陽,聲豪機車行,北投區,112062,臺北市北投區西安街2段185號1樓,(02)28236173,陳信偉
AV9,三陽,人豪機車行,信義區,110014,臺北市信義區莊敬路204號1樓,(02)27234925,葉貂群
